all_emo_word_count	all_emo_word_count_multi	author	avg_neg_dist	avg_pos_dist	datetime	digest	keywordlist	mood	neg_amp_val	neg_amp_val_per_word	neg_emo_word_count	neg_emo_word_count_multi	neg_words_list	page_id	pagesignature	parse_date	pos_amp_val	pos_amp_val_per_word	pos_emo_word_count	pos_emo_word_count_multi	pos_words_list	post_id	postsignature	ratio_all_emo_vs_total	ratio_neg_emo_vs_total	ratio_pos_emo_vs_neg_emo	ratio_pos_emo_vs_total	rawdatetime	sale	sellscore	spam	spamscore	text	text_segmented	title	type	url	
3	[0, 0, 0, 0, 0, 0, 0, 0, 0, 1, 1, 1]	เสือต้นน้ำ	0	354	2014-11-06 22:38:00	b0997be7f42d6b8a38b204b88e3f5f15	la บาท ละบาท ละ ฟรี ราคา ems กแบบ ลิกแบบ จัดส่ง แขน ลิก ลิ จัด	neutral	0	0	0	[0, 0, 0, 0, 0, 0, 0, 0, 0, 0, 0, 0]		0	www.thaimtb.com_816_1099787	2015-01-15 14:14:34	5.0	0	3	[0, 0, 0, 0, 0, 0, 0, 0, 0, 1, 1, 1]	ขอบคุณ โดน ขอบคุณ 	0	www.thaimtb.com_816_1099787_0	0	0	999	0	  06 พ.ย. 2014, 22:38 	0	-0.0	0	-0.0	Tonnam Bike ถุงมือจักรยาน ลายทีมโปร ส่งฟรีทั่วประเทศ มีสินค้าพร้อมส่งทันทีค่ะ แบบ L ถุงมือจักรยาน ลายทีมโปร   . แบบ LA ถุงมือครึ่งนิ้ว ลายทีม ปี    ราคาคู่ละ    บาท ส่งฟรี EMS +   บาท   . แบบ LB ถุงมือเต็มนิ้ว ลายทีม ปี    ราคาคู่ละ    บาท ส่งฟรี EMS +   บาท สามารถสอบถามรายละเอียดเพิ่มเติมได้นะคะ ช่องทางการติดต่อดังนี้ค่ะ  ตอบกระทู้  PM ผ่านกล่องข้อความ   O  .  .    Line ID  TonnamBike  QR Code  Tonnam Bike *-*-*-*-*-*-*-*-*-*-* บัญชีออมทรัพย์ ธนาคารกรุงไทย เลขที่   -  -  -   ชื่อบัญชี Natthaya P. *-*-*-*-*-*-*-*-*-*-* หมายเหตุ  การโอนเงิน รบกวนใส่เศษสตางค์ ให้ตรงกับเลขท้าย    ตัวของเบอร์โทรศัพท์ผู้โอนเงิน เพื่อความสะดวกและ รวดเร็วในการตรวจสอบและ จัดส่งสินค้า ขอบคุณค่ะ การจัดส่งสินค้า ร้านต้นน้ำไบค์ จัดส่งสินค้าทุกวันจันทร์ - วันเสาร์ เวลา   .   น.   . ลูกค้าที่ชำระเงิน ก่อน เวลา   .   น. ทางร้านจะดำเนินการจัดส่งสินค้าภายในวันนั้น   . ลูกค้าที่ชำระเงิน หลัง เวลา   .   น. ทางร้านจะดำเนินการจัดส่งสินค้าภายในวันถัดไป แบบ L ถุงมือกรยาน ลายทีมโปร LA แบบครึ่่งนิ้ว  LA   Bianchi Size  M, L, XL  LA   Cannondale Size  หมดแล้วค่ะ  LA   Euskaltel Size  M, L  LA   Giant Size  M, M, L, L  LA   Le Tour de France  Yello Size  L  LA   Saxo Bank Size  หมดแล้วค่ะ  LA   Sky  Black Size  M, L, XL LB แบบเต็มนิ้ว  LฺB   Specialized  Black Size  หมดแล้วค่ะ  LB   Specialized  Red Size  หมดแล้วค่ะ แบบ L ถุงมือจักรยาน LA แบบครึ่่งนิ้ว  LA   Bianchi  LA   Cannondale  LA   Euskaltel  LA   Giant  LA   Le Tour de France  Yello  LA   Saxo Bank  LA   Sky  Black LB แบบเต็มนิ้ว  LฺB   Specialized  Black  LB   Specialized  Red Tonnam Bike คลิก  แบบ A เสื้อจักรยาน แขนสั้น ราคาตัวละ    บาท แขนยาว ราคาตัวละ    บาท ส่ง EMS ฟรี คลิก  แบบ B ชุดจักรยานแขนสั้น เสื้อแขนสั้น+กางเกงขาสั้นเป้าเจล ราคาชุดละ   ,   บาท ส่ง EMS ฟรี คลิก  แบบ C ชุดเอี๊ยมจักรยานแขนสั้น เสื้อแขนสั้น+กางเกงเอี๊ยมขาสั้น ราคาชุดละ   ,   บาท ส่ง EMS ฟรี คลิก  แบบ D ชุดจักรยานแขนยาว เสื้อแขนยาว+กางเกงขายาว ราคาชุดละ   ,   บาท ส่ง EMS ฟรี คลิก  แบบ E ชุดจักรยาน สำหรับผู้หญิง เสื้อแขนสั้น+กางเกงขาสั้น ราคาชุดละ   ,   บาท ส่ง EMS ฟรี คลิก  แบบ F เสื้อกันลมแขนยาว Le Tour de France สีจี๊ดโดนใจ ราคาตัวละ    บาท ฟรี ค่าจัดส่งลงทะเบียน EMS +   บาท คลิก  แบบ G หมวกแก๊ปลายทีมโปร ราคาใบละ    บาท ฟรี ค่าจัดส่งลงทะเบียน EMS +   บาท คลิก  แบบ H ผ้าโพกหัวลายทีมโปร    บาท ฟรี ค่าจัดส่งลงทะเบียน EMS +   บาท คลิก  แบบ I ถุงครอบรองเท้าลายทีมโปร ราคาคู่ละ    บาท ฟรี ค่าจัดส่งลงทะเบียน EMS +   บาท คลิก  แบบ J ชุดจักรยานแขนสั้นเป้า Coolmax เสื้อแขนสั้น+กางเกงขาสั้นเป้า Coolmax ราคาชุดละ    บาท ฟรี ค่าจัดส่งลงทะเบียน EMS +   บาท คลิก  แบบ K กางเกงจักรยานลายทีมโปร ขาสั้นเป้า Coolmax ราคาตัวละ    บาท ขาสั้นเป้าเจล ราคาตัวละ    บาท เอี๊ยมขาสั้นเป้าเจล ราคาตัวละ    บาท ขายาวเป้าเจล ราคาตัวละ    บาท ส่ง EMS ฟรี คลิก  แบบ L ถุงมือจักรยานลายทีมโปร แบบครึ่งนิ้ว ราคาคู่ละ    บาท แบบเต็มนิ้ว ราคาคู่ละ    บาท ฟรี ค่าจัดส่งลงทะเบียน EMS +   บาท คลิก  แบบ M ปลอกแขน และ ปลอกขา ปลอกแขน ราคาคู่ละ    บาท ปลอกขา ราคาคู่ละ    บาท ปลอกขา Le Tour de France ราคาคู่ละ    บาท ฟรี ค่าจัดส่งลงทะเบียน EMS +   บาท Click  สินค้าแบบอื่น  ของร้าน Tonnam Bike  Click สามารถสอบถามรายละเอียดเพิ่มเติมได้นะคะ ช่องทางการติดต่อดังนี้ค่ะ  ตอบกระทู้  PM ผ่านกล่องข้อความ   O  .  .    Line ID  TonnamBike  QR Code  Tonnam Bike *-*-*-*-*-*-*-*-*-*-* บัญชีออมทรัพย์ ธนาคารกรุงไทย เลขที่   -  -  -   ชื่อบัญชี Natthaya P. *-*-*-*-*-*-*-*-*-*-* หมายเหตุ  การโอนเงิน รบกวนใส่เศษสตางค์ ให้ตรงกับเลขท้าย    ตัวของเบอร์โทรศัพท์ผู้โอนเงิน เพื่อความสะดวกและ รวดเร็วในการตรวจสอบและ จัดส่งสินค้า ขอบคุณค่ะ __ ..หนทางยาวไกลนับหมื่นลี้ .. ต้องเริ่มต้นด้วยก้าวแรกก่อนเสมอ.. .. พื้นที่ชีวิต ..   O  .  .   Line ID  TonnamBike บัญชีออมทรัพย์ ธนาคารกรุงไทย เลขที่   -  -  -   ชื่อบัญชี Natthaya P	Tonnam Bike ถุง มือ จักรยาน ลาย ทีม โป ร ส่ง ฟรี ทั่ว ประเทศ มี สินค้า พร้อม ส่ง ทันที ค่ะ แบบ L ถุง มือ จักรยาน ลาย ทีม โป ร . แบบ LA ถุง มือ ครึ่ง นิ้ว ลาย ทีม ปี ราคา คู่ ละ บาท ส่ง ฟรี EMS + บาท . แบบ LB ถุง มือ เต็ม นิ้ว ลาย ทีม ปี ราคา คู่ ละ บาท ส่ง ฟรี EMS + บาท สามารถ สอบ ถาม ราย ละเอียด เพิ่ม เติม ได้ นะ คะ ช่อง ทางการ ติดต่อ ดังนี้ ค่ะ ตอบ กระทู้ PM ผ่า นก ล่อง ข้อความ O . . Line ID TonnamBike QR Code Tonnam Bike * - * - * - * - * - * - * - * - * - * - * บัญชี ออม ทรัพย์ ธนาคาร กรุง ไทย เลข ที่ - - - ชื่อ บัญชี Natthaya P . * - * - * - * - * - * - * - * - * - * - * หมายเหตุ การ โอน เงิน รบกวน ใส่ เศษ สตางค์ ให้ ตรง กับ เลข ท้าย ตัว ของ เบอร์ โทรศัพท์ ผู้ โอน เงิน เพื่อ ความ สะดวก และ รวดเร็ว ใน การ ตรวจ สอบ และ จัด ส่ง สินค้า ขอบคุณ ค่ะ การ จัด ส่ง สินค้า ร้าน ต้นน้ำ ไบค์ จัด ส่ง สินค้า ทุก วัน จันทร์ - วัน เสาร์ เวลา . น. . ลูกค้า ที่ ชำระ เงิน ก่อน เวลา . น. ทาง ร้าน จะ ดำเนิน การ จัด ส่ง สินค้า ภาย ใน วัน นั้น . ลูกค้า ที่ ชำระ เงิน หลัง เวลา . น. ทาง ร้าน จะ ดำเนิน การ จัด ส่ง สินค้า ภาย ใน วัน ถัด ไป แบบ L ถุง มือ กร ยาน ลาย ทีม โป ร LA แบบ ครึ่่ง นิ้ว LA Bianchi Size M , L , XL LA Cannondale Size หมด แล้ว ค่ะ LA Euskaltel Size M , L LA Giant Size M , M , L , L LA Le Tour de France Yello Size L LA Saxo Bank Size หมด แล้ว ค่ะ LA Sky Black Size M , L , XL LB แบบ เต็ม นิ้ว L ฺ B Specialized Black Size หมด แล้ว ค่ะ LB Specialized Red Size หมด แล้ว ค่ะ แบบ L ถุง มือ จักรยาน LA แบบ ครึ่่ง นิ้ว LA Bianchi LA Cannondale LA Euskaltel LA Giant LA Le Tour de France Yello LA Saxo Bank LA Sky Black LB แบบ เต็ม นิ้ว L ฺ B Specialized Black LB Specialized Red Tonnam Bike ค ลิ ก แบบ A เสื้อ จักรยาน แขน สั้น ราคา ตัว ละ บาท แขน ยาว ราคา ตัว ละ บาท ส่ง EMS ฟรี ค ลิ ก แบบ B ชุด จักรยาน แขน สั้น เสื้อ แขน สั้น + กางเกง ขา สั้น เป้า เจ ล ราคา ชุด ละ , บาท ส่ง EMS ฟรี ค ลิ ก แบบ C ชุด เอี๊ยม จักรยาน แขน สั้น เสื้อ แขน สั้น + กางเกง เอี๊ยม ขา สั้น ราคา ชุด ละ , บาท ส่ง EMS ฟรี ค ลิ ก แบบ D ชุด จักรยาน แขน ยาว เสื้อ แขน ยาว + กางเกง ขา ยาว ราคา ชุด ละ , บาท ส่ง EMS ฟรี ค ลิ ก แบบ E ชุด จักรยาน สำหรับ ผู้หญิง เสื้อ แขน สั้น + กางเกง ขา สั้น ราคา ชุด ละ , บาท ส่ง EMS ฟรี ค ลิ ก แบบ เสื้อ กัน ลม แขน ยาว Le Tour de France สี จี๊ด โดน ใจ ราคา ตัว ละ บาท ฟรี ค่า จัด ส่ง ลง ทะเบียน EMS + บาท ค ลิ ก แบบ G หมวกแก๊ป ลาย ทีม โป ร ราคา ใบ ละ บาท ฟรี ค่า จัด ส่ง ลง ทะเบียน EMS + บาท ค ลิ ก แบบ H ผ้า โพก หัว ลาย ทีม โป ร บาท ฟรี ค่า จัด ส่ง ลง ทะเบียน EMS + บาท ค ลิ ก แบบ I ถุง ครอบ รองเท้า ลาย ทีม โป ร ราคา คู่ ละ บาท ฟรี ค่า จัด ส่ง ลง ทะเบียน EMS + บาท ค ลิ ก แบบ J ชุด จักรยาน แขน สั้น เป้า Coolmax เสื้อ แขน สั้น + กางเกง ขา สั้น เป้า Coolmax ราคา ชุด ละ บาท ฟรี ค่า จัด ส่ง ลง ทะเบียน EMS + บาท ค ลิ ก แบบ K กางเกง จักรยาน ลาย ทีม โป ร ขา สั้น เป้า Coolmax ราคา ตัว ละ บาท ขา สั้น เป้า เจ ล ราคา ตัว ละ บาท เอี๊ยม ขา สั้น เป้า เจ ล ราคา ตัว ละ บาท ขา ยาว เป้า เจ ล ราคา ตัว ละ บาท ส่ง EMS ฟรี ค ลิ ก แบบ L ถุง มือ จักรยาน ลาย ทีม โป ร แบบ ครึ่ง นิ้ว ราคา คู่ ละ บาท แบบ เต็ม นิ้ว ราคา คู่ ละ บาท ฟรี ค่า จัด ส่ง ลง ทะเบียน EMS + บาท ค ลิ ก แบบ M ปลอก แขน และ ปลอก ขา ปลอก แขน ราคา คู่ ละ บาท ปลอก ขา ราคา คู่ ละ บาท ปลอก ขา Le Tour de France ราคา คู่ ละ บาท ฟรี ค่า จัด ส่ง ลง ทะเบียน EMS + บาท Click สินค้า แบบ อื่น ของ ร้าน Tonnam Bike Click สามารถ สอบ ถาม ราย ละเอียด เพิ่ม เติม ได้ นะ คะ ช่อง ทางการ ติดต่อ ดังนี้ ค่ะ ตอบ กระทู้ PM ผ่า นก ล่อง ข้อความ O . . Line ID TonnamBike QR Code Tonnam Bike * - * - * - * - * - * - * - * - * - * - * บัญชี ออม ทรัพย์ ธนาคาร กรุง ไทย เลข ที่ - - - ชื่อ บัญชี Natthaya P . * - * - * - * - * - * - * - * - * - * - * หมายเหตุ การ โอน เงิน รบกวน ใส่ เศษ สตางค์ ให้ ตรง กับ เลข ท้าย ตัว ของ เบอร์ โทรศัพท์ ผู้ โอน เงิน เพื่อ ความ สะดวก และ รวดเร็ว ใน การ ตรวจ สอบ และ จัด ส่ง สินค้า ขอบคุณ ค่ะ _ _ . . หนทาง ยาว ไกล นับ หมื่น ลี้ . . ต้อง เริ่ม ต้น ด้วย ก้าว แรก ก่อน เสมอ . . . . พื้น ที่ ชีวิต . . O . . Line ID TonnamBike บัญชี ออม ทรัพย์ ธนาคาร กรุง ไทย เลข ที่ - - - ชื่อ บัญชี Natthaya P 	Tonnam Bike แบบ L ถุงมือจักรยาน ลายทีมโปร แบบครึ่งนิ้ว ราคาคู่ละ    บาท และ แบบเต็มนิ้ว ราคาคู่ละ    บาท ส่งฟรีทั่วประเทศ	post	http://www.thaimtb.com/forum/viewtopic.php?f=816&t=1099787	
1	[1, 1, 1, 1, 1, 1, 1, 1, 1, 1, 1, 1]	rangsany007	0	0	2014-11-22 15:18:00	e9d51f53da2bc2469a7546d21e5ed925	ซักหน่อย ซัก หน่อย ต้องตัด ตัดซัก ตัด เดือน สิ้น น่าสนใจ น่า สนใจ	positive	0	0	0	[0, 0, 0, 0, 0, 0, 0, 0, 0, 0, 0, 0]		0	www.thaimtb.com_816_1099799	2015-01-15 14:14:33	1.5	13	1	[1, 1, 1, 1, 1, 1, 1, 1, 1, 1, 1, 1]	สนใจ 	1	www.thaimtb.com_816_1099799_1	0	0	999	0	  22 พ.ย. 2014, 15:18 	1	-0.0	1	-0.0	น่าสนใจครับ สิ้นเดือนต้องตัดซักหน่อยแล้ว	น่า สนใจ ครับ สิ้น เดือน ต้อง ตัด ซัก หน่อย แล้ว 		comment	http://www.thaimtb.com/forum/viewtopic.php?f=816&t=1099799	
1	[1, 1, 1, 1, 1, 1, 1, 1, 1, 1, 1, 1]	Kawhom	0	0	2015-01-14 15:14:00	d1a6b27b62403c0882b52c70bee91bcc	สวย	positive	0	0	0	[0, 0, 0, 0, 0, 0, 0, 0, 0, 0, 0, 0]		0	www.thaimtb.com_544_1146410	2015-01-15 14:14:34	1.0	50	1	[1, 1, 1, 1, 1, 1, 1, 1, 1, 1, 1, 1]	สวย 	1	www.thaimtb.com_544_1146410_1	0	0	999	0	  เมื่อวานนี้, 15:14 	1	-0.0	1	-0.0	สวย	สวย 		comment	http://www.thaimtb.com/forum/viewtopic.php?f=544&p=11617950&t=1146410	
0	[0, 0, 0, 0, 0, 0, 0, 0, 0, 0, 0, 0]	mr.T_Technic	0	0	2014-11-19 20:40:00	6b8cde63f25b5963c3444660ab86f79c	ทุกท ไซด์m ทุกทีม มีโอกาส ไร้ ไปทุก เท่าไร โอกาส เราไร้ เพราะ ไปทุกท มีหรือ สังกัด หรือไม่	neutral	0	0	0	[0, 0, 0, 0, 0, 0, 0, 0, 0, 0, 0, 0]		0	www.thaimtb.com_816_1099787	2015-01-15 14:14:34	0	0	0	[0, 0, 0, 0, 0, 0, 0, 0, 0, 0, 0, 0]		1	www.thaimtb.com_816_1099787_1	0	0	999	0	  19 พ.ย. 2014, 20:40 	1	-0.0	1	-0.0	lb   ไซด์mมีหรือ ไม่ ไซด์s ขนาดเท่าไร __ ร่วมทุกทีม..ไปทุกทริป..ที่มีโอกาส.เพราะเราไร้สังกัด	lb ไซด์m มี หรือ ไม่ ไซด์s ขนาด เท่าไร _ _ ร่วม ทุก ทีม . . ไป ทุก ท ริ ป . . ที่ มี โอกาส . เพราะ เรา ไร้ สังกัด 		comment	http://www.thaimtb.com/forum/viewtopic.php?f=816&t=1099787	
0	[0, 0, 0, 0, 0, 0, 0, 0, 0, 0, 0, 0]	velodrome	0	0	2015-01-14 14:34:00	d41d8cd98f00b204e9800998ecf8427e		neutral	0	0	0	[0, 0, 0, 0, 0, 0, 0, 0, 0, 0, 0, 0]		0	www.thaimtb.com_524_1146413	2015-01-15 14:14:35	0	0	0	[0, 0, 0, 0, 0, 0, 0, 0, 0, 0, 0, 0]		0	www.thaimtb.com_524_1146413_0	0	0	999	0	  เมื่อวานนี้, 14:34 	0	-0.0	1	-0.0			เฟรมเสือหมอบ รถเสือหมอบวินเทจ VINTAGE RICKERT SUPER VITUS	post	http://www.thaimtb.com/forum/viewtopic.php?f=524&t=1146413	
0	[0, 0, 0, 0, 0, 0, 0, 0, 0, 0, 0, 0]	pingpongcha	0	0	2014-11-18 22:51:00	d41d8cd98f00b204e9800998ecf8427e		neutral	0	0	0	[0, 0, 0, 0, 0, 0, 0, 0, 0, 0, 0, 0]		0	www.thaimtb.com_816_960281	2015-01-15 14:14:35	0	0	0	[0, 0, 0, 0, 0, 0, 0, 0, 0, 0, 0, 0]		11	www.thaimtb.com_816_960281_11	0	0	999	0	  18 พ.ย. 2014, 22:51 	1	-0.0	1	-0.0				comment	http://www.thaimtb.com/forum/viewtopic.php?f=816&t=960281	
1	[1, 1, 1, 1, 1, 1, 0, 0, 0, 1, 1, 1]	siripognapat	0	0	2015-01-14 14:38:00	ffa0b492409fca86ed99f5e49ac759ce	บัว แดนที่ ตากเลข สิริ jpg ไทยโทร บรรพจน์ ตำรวจ กำกับ dahonspeed ภัทร ตระเวน การตำรวจ หมู่	positive	0	0	0	[0, 0, 0, 0, 0, 0, 0, 0, 0, 0, 0, 0]		0	www.thaimtb.com_534_1146415	2015-01-15 14:14:36	1.5	2	1	[1, 1, 1, 1, 1, 1, 0, 0, 0, 1, 1, 1]	ขอบคุณ 	0	www.thaimtb.com_534_1146415_0	0	0	999	0	  เมื่อวานนี้, 14:38 	0	-0.0	0	-0.0	DAHON Speed    ขายแล้วขอบคุณครับ พร้อมส่ง ด.ต.บรรพจน์ สิริพงษ์ณภัทร กองกำกับการตำรวจตระเวนชายแดนที่       หมู่    ต.หนองบัวใต้ อ.เมือง จ.ตาก    เลขที่บัญชี    -    กรุงไทย โทร    -    ไฟล์แนป DSCF  .jpg [   .   KiB เปิดดู    ครั้ง 	DAHON Speed ขาย แล้ว ขอบคุณ ครับ พร้อม ส่ง ด . ต . บร รพจน์ สิริ พงษ์ณ ภัทร กอง กำกับ การ ตำรวจ ตระเวน ชาย แดน ที่ หมู่ ต. หนอง บัว ใต้ อ. เมือง จ. ตาก เลข ที่ บัญชี - กรุง ไทย โทร - ไฟล์แนป DSCF . jpg [ . KiB เปิด ดู ครั้ง 	DAHON Speed    ขายแล้วขอบคุณครับ 	post	http://www.thaimtb.com/forum/viewtopic.php?f=534&p=11617802&t=1146415	
