all_emo_word_count	all_emo_word_count_multi	author	avg_neg_dist	avg_pos_dist	datetime	digest	keywordlist	mood	neg_amp_val	neg_amp_val_per_word	neg_emo_word_count	neg_emo_word_count_multi	neg_words_list	page_id	pagesignature	parse_date	pos_amp_val	pos_amp_val_per_word	pos_emo_word_count	pos_emo_word_count_multi	pos_words_list	post_id	postsignature	ratio_all_emo_vs_total	ratio_neg_emo_vs_total	ratio_pos_emo_vs_neg_emo	ratio_pos_emo_vs_total	rawdatetime	sale	sellscore	spam	spamscore	text	text_segmented	title	type	url	
1	[0, 1, 1, 1, 1, 1, 0, 0, 0, 1, 1, 1]	Bike-MinimarT	0	0	2015-01-14 14:43:00	05fc8fce0b80a9be09a08e536b5f6807	ปลด ข้อ มีปัญหา ปัญหา ข้อต่อ ต่อ เร็ว หน้า ง่าม มาเลือก ด้วยนะ เร็วปลด คาด เร็วแบบ	positive	-1.5	-2	1	[0, 1, 1, 1, 1, 1, 0, 0, 0, 1, 1, 1]	ช้า 	0	www.thaimtb.com_910_1146420	2015-01-15 14:14:40	0	0	0	[0, 0, 0, 0, 0, 0, 0, 0, 0, 0, 0, 0]		0	www.thaimtb.com_910_1146420_0	0	0	0	0	  เมื่อวานนี้, 14:43 	0	-0.0	0	-0.0	สำหรับคนที่มีปัญหาหรือ คาดว่าจะมีปัญหาสำหรับข้อต่อใส่เร็วปลดช้าทั้งหลายครับ คีม ปลดใส่ ข้อต่อปลดเร็วแบบ    ง่าม ราคา    ส่งลงทะเบียน+   ems+   __ ฝากร้านเล็ก ด้วยนะครับ ขาดอะไรลองเข้ามาเลือกชมได้ครับ หน้าเว็บร้านค้าครับ  หน้าเฟชบุคร้าน  Bike-MinimarT Facebook หรือ ติดต่อ   -  -   Line bikeminimart	สำหรับ คน ที่ มี ปัญหา หรือ คาด ว่า จะ มี ปัญหา สำหรับ ข้อ ต่อ ใส่ เร็ว ปลด ช้า ทั้งหลาย ครับ คีม ปลด ใส่ ข้อ ต่อ ปลด เร็ว แบบ ง่าม ราคา ส่ง ลง ทะเบียน + ems + _ _ ฝาก ร้าน เล็ก ด้วย นะ ครับ ขาด อะไร ลอง เข้า มา เลือก ชม ได้ ครับ หน้า เว็บ ร้าน ค้า ครับ หน้า เฟช บุ คร้าน Bike - MinimarT Facebook หรือ ติดต่อ - - Line bikeminimart 	คีมปลดคีมถ่างในหลอดเดียวกัน	post	http://www.thaimtb.com/forum/viewtopic.php?f=910&p=11617817&t=1146420	
1	[1, 1, 1, 1, 1, 1, 0, 1, 1, 1, 1, 1]	sunti123	0	0	2014-11-18 20:13:00	1e7ea6c1c4f6ae9e38923d50b8efc7cb	jgiant ผมสูงเอว ที่ครับ แบบที่ ผมสูง เอว สูงเอว เอวใส่ อะไร ครับผม giant สูง size ใส่	positive	0	0	0	[0, 0, 0, 0, 0, 0, 0, 0, 0, 0, 0, 0]		0	www.thaimtb.com_816_1053887	2015-01-15 14:14:42	1.5	10	1	[1, 1, 1, 1, 1, 1, 0, 1, 1, 1, 1, 1]	สนใจ 	7	www.thaimtb.com_816_1053887_7	0	0	999	0	  18 พ.ย. 2014, 20:13 	1	-0.0	1	-0.0	สนใจJ   Giant แบบที่   ครับ ผมสูง   เอว   ใส่size อะไรครับ 	สนใจ J Giant แบบ ที่ ครับ ผม สูง เอว ใส่ size อะไร ครับ 		comment	http://www.thaimtb.com/forum/viewtopic.php?f=816&t=1053887	
0	[0, 0, 0, 0, 0, 0, 0, 0, 0, 0, 0, 0]	jorama9	0	0	2014-12-19 14:50:00	84af1fe5f2ce8f391d0e04bc829a1349	ใต้ฝ่า ขอดู ดูรูป ฝ่า ขอดูรูป ดูรูปใต้ ฝ่ามือ รูปใต้ มือหน่อย หน่อย ใต้ รูป มือ	neutral	0	0	0	[0, 0, 0, 0, 0, 0, 0, 0, 0, 0, 0, 0]		0	www.thaimtb.com_816_1099787	2015-01-15 14:14:34	0	0	0	[0, 0, 0, 0, 0, 0, 0, 0, 0, 0, 0, 0]		2	www.thaimtb.com_816_1099787_2	0	0	999	0	  19 ธ.ค. 2014, 14:50 	1	-0.0	1	-0.0	ขอดูรูปใต้ฝ่ามือหน่อยครับ 	ขอ ดู รูป ใต้ ฝ่า มือ หน่อย ครับ 		comment	http://www.thaimtb.com/forum/viewtopic.php?f=816&t=1099787	
0	[0, 0, 0, 0, 0, 0, 0, 0, 0, 0, 0, 0]	velodrome	0	0	2015-01-14 14:35:00	d41d8cd98f00b204e9800998ecf8427e		neutral	0	0	0	[0, 0, 0, 0, 0, 0, 0, 0, 0, 0, 0, 0]		0	www.thaimtb.com_524_1146413	2015-01-15 14:14:35	0	0	0	[0, 0, 0, 0, 0, 0, 0, 0, 0, 0, 0, 0]		1	www.thaimtb.com_524_1146413_1	0	0	999	0	  เมื่อวานนี้, 14:35 	1	-0.0	1	-0.0				comment	http://www.thaimtb.com/forum/viewtopic.php?f=524&t=1146413	
1	[1, 1, 1, 1, 1, 1, 1, 1, 1, 1, 1, 1]	phantom	0	0	2014-11-24 21:27:00	64226060ab68538729d4b4042b91184d	ชัยไป ดีมีชัย มีชัยไป มีชัย ไปกว่า ดีมี ชัย อุปกรณ์ ครึ่ง	positive	0	0	0	[0, 0, 0, 0, 0, 0, 0, 0, 0, 0, 0, 0]		0	www.thaimtb.com_816_960281	2015-01-15 14:14:35	1.0	11	1	[1, 1, 1, 1, 1, 1, 1, 1, 1, 1, 1, 1]	ดี 	12	www.thaimtb.com_816_960281_12	0	0	999	0	  24 พ.ย. 2014, 21:27 	1	-0.0	1	-0.0	 อุปกรณ์ดี มีชัยไปกว่าครึ่ง	 อุปกรณ์ ดี มี ชัย ไป กว่า ครึ่ง 		comment	http://www.thaimtb.com/forum/viewtopic.php?f=816&t=960281	
0	[0, 0, 0, 0, 0, 0, 0, 0, 0, 0, 0, 0]	Bike-MinimarT	0	0	2015-01-14 14:45:00	6aa170947f58e8caf4ef7ae3365737dd	หน้า cn แบบไม่ ข้อแบบ ยาวข้อ แบบไม่มี มีกล่อง มาเลือก หน้าเฟช ด้วยนะ linebikeminimart กล่อง เฟช อะไรลอง	neutral	0	0	0	[0, 0, 0, 0, 0, 0, 0, 0, 0, 0, 0, 0]		0	www.thaimtb.com_910_1146423	2015-01-15 14:14:46	0	0	0	[0, 0, 0, 0, 0, 0, 0, 0, 0, 0, 0, 0]		0	www.thaimtb.com_910_1146423_0	0	0	999	0	  เมื่อวานนี้, 14:45 	0	-0.0	0	-0.0	โซ่ cn   สำหรับ     speed ยาว  ข้อ แบบไม่มีกล่องครับ ราคา    ส่งลงทะเบียน +   ems+   __ ฝากร้านเล็ก ด้วยนะครับ ขาดอะไรลองเข้ามาเลือกชมได้ครับ หน้าเว็บร้านค้าครับ  หน้าเฟชบุคร้าน  Bike-MinimarT Facebook หรือ ติดต่อ   -  -   Line bikeminimart	โซ่ cn สำหรับ speed ยาว ข้อ แบบ ไม่ มี กล่อง ครับ ราคา ส่ง ลง ทะเบียน + ems + _ _ ฝาก ร้าน เล็ก ด้วย นะ ครับ ขาด อะไร ลอง เข้า มา เลือก ชม ได้ ครับ หน้า เว็บ ร้าน ค้า ครับ หน้า เฟช บุ คร้าน Bike - MinimarT Facebook หรือ ติดต่อ - - Line bikeminimart 	โซ่      speed	post	http://www.thaimtb.com/forum/viewtopic.php?f=910&p=11617826&t=1146423	
1	[0, 0, 1, 1, 1, 1, 0, 1, 1, 1, 1, 1]	velodrome	0	0	2015-01-14 14:36:00	537f97ee764a8fb95a878d263943dcf8	ถามได้ หาอะใหล่ ครับจะ kkchu หรือทาง post อบ lineidkkchu idkkchu อบถาม อบถามได้ มาส จะตอบทุก อะใหล่	positive	0	0	0	[0, 0, 0, 0, 0, 0, 0, 0, 0, 0, 0, 0]		0	www.thaimtb.com_524_1146413	2015-01-15 14:14:35	1.5	4	1	[0, 0, 1, 1, 1, 1, 0, 1, 1, 1, 1, 1]	ขอบคุณ 	2	www.thaimtb.com_524_1146413_2	0	0	999	0	  เมื่อวานนี้, 14:36 	1	-0.0	1	-0.0	หาอะใหล่ รายการอื่น  post หรือ pm เข้ามาสอบถามได้ครับ จะตอบทุกข้อความทาง p.m ครับ ขอบคุณครับ โทร   -  ,   -   velodrome หรือ ทาง LINE ID  kkchu	หา อะใหล่ รายการ อื่น post หรือ pm เข้า มาส อบ ถาม ได้ ครับ จะ ตอบ ทุก ข้อความ ทาง p . m ครับ ขอบคุณ ครับ โทร - , - velodrome หรือ ทาง LINE ID kkchu 		comment	http://www.thaimtb.com/forum/viewtopic.php?f=524&t=1146413	
1	[0, 0, 1, 1, 1, 1, 1, 1, 1, 1, 1, 1]	cremmm	0	0	2015-01-14 15:02:00	a25ad20c3a957917eec0a0709f7e252d	ทอัพ พร้อมใช้ เซ เซทอัพ ใส่ของ ท่อ ล้อใส่ riteway ขายสนใจ ท่อนั่ง นั่ง เฟรมอลู รมอลู รมอลูมิ	positive	0	0	0	[0, 0, 0, 0, 0, 0, 0, 0, 0, 0, 0, 0]		0	www.thaimtb.com_808_1146440	2015-01-15 14:14:46	1.5	4	1	[0, 0, 1, 1, 1, 1, 1, 1, 1, 1, 1, 1]	สนใจ 	0	www.thaimtb.com_808_1146440_0	0	0	999	0	  เมื่อวานนี้, 15:02 	0	-0.0	0	-0.0	riteway - เฟรมอลูมิเนียม -    speed - เซทอัพพร้อมใช้ - ท่อนั่ง   .   - เซทอัพพร้อมใช้ - ขาย    สนใจติดต่อ    ล้อ ใส่ของ A.N	riteway - เฟ รม อลู มิ เนียม - speed - เซ ทอัพ พร้อม ใช้ - ท่อ นั่ง . - เซ ทอัพ พร้อม ใช้ - ขาย สนใจ ติดต่อ ล้อ ใส่ ของ A . N 	ไฮบริด ล้อ   c สองคันครับ 	post	http://www.thaimtb.com/forum/viewtopic.php?f=808&p=11617924&t=1146440	
0	[0, 0, 0, 0, 0, 0, 0, 0, 0, 0, 0, 0]	cremmm	0	0	2015-01-14 15:03:00	d41d8cd98f00b204e9800998ecf8427e		neutral	0	0	0	[0, 0, 0, 0, 0, 0, 0, 0, 0, 0, 0, 0]		0	www.thaimtb.com_808_1146440	2015-01-15 14:14:46	0	0	0	[0, 0, 0, 0, 0, 0, 0, 0, 0, 0, 0, 0]		1	www.thaimtb.com_808_1146440_1	0	0	999	0	  เมื่อวานนี้, 15:03 	1	-0.0	1	-0.0				comment	http://www.thaimtb.com/forum/viewtopic.php?f=808&p=11617924&t=1146440	
1	[0, 1, 1, 1, 1, 1, 1, 1, 1, 1, 1, 1]	cremmm	0	0	2015-01-14 15:06:00	842e2d101b5c925611be04c8ad85c3f2	วงล้อขาย ใช้วง nodtard ใช้วงล้อ ล้อขาย ทอัพ พร้อมใช้ ขายสนใจ เซ เซทอัพ เฟรมอลู รมอลู วงล้อ วง	positive	0	0	0	[0, 0, 0, 0, 0, 0, 0, 0, 0, 0, 0, 0]		0	www.thaimtb.com_808_1146440	2015-01-15 14:14:46	1.5	9	1	[0, 1, 1, 1, 1, 1, 1, 1, 1, 1, 1, 1]	สนใจ 	2	www.thaimtb.com_808_1146440_2	0	0	999	0	  เมื่อวานนี้, 15:06 	1	-0.0	1	-0.0	NODTARD  เฟรมอลู -    speed  เซทอัพพร้อมใช้ วงล้อ    ขาย    สนใจติดต่อ  	NODTARD เฟ รม อลู - speed เซ ทอัพ พร้อม ใช้ วง ล้อ ขาย สนใจ ติดต่อ 		comment	http://www.thaimtb.com/forum/viewtopic.php?f=808&p=11617924&t=1146440	
0	[0, 0, 0, 0, 0, 0, 0, 0, 0, 0, 0, 0]	cremmm	0	0	2015-01-14 15:07:00	d41d8cd98f00b204e9800998ecf8427e		neutral	0	0	0	[0, 0, 0, 0, 0, 0, 0, 0, 0, 0, 0, 0]		0	www.thaimtb.com_808_1146440	2015-01-15 14:14:46	0	0	0	[0, 0, 0, 0, 0, 0, 0, 0, 0, 0, 0, 0]		3	www.thaimtb.com_808_1146440_3	0	0	999	0	  เมื่อวานนี้, 15:07 	1	-0.0	1	-0.0				comment	http://www.thaimtb.com/forum/viewtopic.php?f=808&p=11617924&t=1146440	
3	[0, 1, 1, 1, 1, 2, 0, 1, 1, 1, 2, 2]	ไบค์สแควร์	0	93	2014-11-18 11:39:00	9f762784f864eeac3be875adf32d5f60	โอน ซื้อ โอนเงิน เงิน มีช่อง สะพาน cm พอ เมื่อ น้ำหนัก แจ้ง บาท เงินที่ อุกฤษฏ์	positive	0	0	0	[0, 0, 0, 0, 0, 0, 0, 0, 0, 0, 0, 0]		0	www.thaimtb.com_881_1108163	2015-01-15 14:14:50	3.5	1	3	[0, 1, 1, 1, 1, 2, 0, 1, 1, 1, 2, 2]	สนใจ ดี เยี่ยม 	0	www.thaimtb.com_881_1108163_0	0	0	999	0	  18 พ.ย. 2014, 11:39 	0	-0.0	0	-0.0	ร้าน ไบค์ สแควร์ BIKE    ยินดีต้อนรับ ซื้อของร้านนี้ มั่นใจ ได้ของถูกชัวร์ สนใจสั่งซื้อโทร   -   / หรือ PM / line  ukrit.ra วิธีการสั่งซื้อ   . กรูณาเช็คสินค้าก่อนโอนเงินครับ   . สามารถสั่งซื้อและ แจ้งโอนเงินได้ทั้งทางโทรศัพท์ / PM /Line   . โอนเงินแล้ว แจ้งยอด /วันที่ /เวลาโอน ก็ พอครับ โอนเงินที่ ธ.กสิกรไทย    อุกฤษฏ์ รัตนโชติ จัดส่งเสร็จแล้วจะแจ้งเลขพัสดุไปรษณีย์ให้ทราบครับ ** Roswheel เป้สะพานหลัง ลดพิเศษเหลือเพียง    บาท ส่งฟรีลงทะเบียน /EMS+  บาท จากราคาเดิม    บาท รายละเอียด -ผลิตจาก Polyester    D ผ้าเนื้อดี น้ำหนักเบา กันน้ำพอประมาณ -สามารถพับเก็ บเป็นกระเป๋าเล็ก พกพาง่าย ขนาดเมื่อกางเต็ม   .  x  x   cm ขนาดเมื่อพับ   x  .   cm ความจุ    ลิตร น้ำหนัก   .   kg -มีช่องพิเศษ ใส่หมวกจักรยานได้ สายสะพานมีช่องเกี่ยวของ ด้านข้างมีช่องใส่ขวดน้ำโดยเฉพาะ -ล็อตนี้ มีสีเทา-ดำ กับ สีน้ำเงิน-ดำ __ เยี่ยมชมร้าน ไบค์ สแควร์ BIKE   โอนเงินที่  กสิกร    อุกฤษฏ์ LINE ID  ukritra TEL   	ร้าน ไบค์ สแควร์ BIKE ยินดี ต้อนรับ ซื้อ ของ ร้าน นี้ มั่น ใจ ได้ ของ ถูก ชัวร์ สนใจ สั่ง ซื้อ โทร - / หรือ PM / line ukrit . ra วิธี การ สั่ง ซื้อ . กรู ณา เช็ค สินค้า ก่อน โอน เงิน ครับ . สามารถ สั่ง ซื้อ และ แจ้ง โอน เงิน ได้ ทั้ง ทาง โทรศัพท์ / PM / Line . โอน เงิน แล้ว แจ้ง ยอด / วัน ที่ / เวลา โอน ก็ พอ ครับ โอน เงิน ที่ ธ. กสิกร ไทย อุกฤษฏ์ รัตน โชติ จัด ส่ง เสร็จ แล้ว จะแจ้ง เลข พัสดุ ไปรษณีย์ ให้ ทราบ ครับ * * Roswheel เป้ สะพาน หลัง ลด พิ เศษ เหลือ เพียง บาท ส่ง ฟรี ลง ทะเบียน / EMS + บาท จาก ราคา เดิม บาท ราย ละเอียด - ผลิต จาก Polyester D ผ้า เนื้อ ดี น้ำหนัก เบา กัน น้ำ พอ ประมาณ - สามารถ พับ เก็ บ เป็น กระเป๋า เล็ก พก พา ง่าย ขนาด เมื่อ กาง เต็ม . x x cm ขนาด เมื่อ พับ x . cm ความ จุ ลิตร น้ำหนัก . kg - มี ช่อง พิ เศษ ใส่ หมวก จักรยาน ได้ สาย สะพาน มี ช่อง เกี่ยว ของ ด้าน ข้าง มี ช่อง ใส่ ขวด น้ำ โดย เฉพาะ - ล็อต นี้ มี สี เทา - ดำ กับ สี น้ำเงิน - ดำ _ _ เยี่ยม ชม ร้าน ไบค์ สแควร์ BIKE โอน เงิน ที่ กสิกร อุกฤษฏ์ LINE ID ukritra TEL 	Roswheel เป้สะพานหลัง สำหรับชาวจักรยาน สวย พกพาง่าย ฟังก์ชั่นเพียบ ลดพิเศษ	post	http://www.thaimtb.com/forum/viewtopic.php?f=881&t=1108163	
2	[0, 1, 1, 1, 1, 1, 0, 1, 1, 1, 1, 1]	ไบค์สแควร์	0	166	2015-01-07 12:52:00	c156b31a3c670176c283c040fc76e0dc	โอน ซื้อ โอนเงิน เงิน ได้ทั้ง ด้าน แจ้ง เงินที่ อุกฤษฏ์ สแควร์ ไบค์ กสิกร ทั้ง pm	positive	0	0	0	[0, 0, 0, 0, 0, 0, 0, 0, 0, 0, 0, 0]		0	www.thaimtb.com_881_1141340	2015-01-15 14:14:51	2.5	1	2	[0, 1, 1, 1, 1, 1, 0, 1, 1, 1, 1, 1]	สนใจ เยี่ยม 	0	www.thaimtb.com_881_1141340_0	0	0	999	0	  07 ม.ค. 2015, 12:52 	0	-0.0	0	-0.0	ร้าน ไบค์ สแควร์ BIKE    ยินดีต้อนรับ ซื้อของร้านนี้ มั่นใจ ได้ของถูกชัวร์ สนใจสั่งซื้อโทร   -   / หรือ PM / line  ukrit.ra วิธีการสั่งซื้อ   . กรูณาเช็คสินค้าก่อนโอนเงินครับ   . สามารถสั่งซื้อและ แจ้งโอนเงินได้ทั้งทางโทรศัพท์ / PM /Line   . โอนเงินแล้ว แจ้งยอด /วันที่ /เวลาโอน ก็ พอครับ โอนเงินที่ ธ.กสิกรไทย    อุกฤษฏ์ รัตนโชติ จัดส่งเสร็จแล้วจะแจ้งเลขพัสดุไปรษณีย์ให้ทราบครับ ** Roswheel กระเป๋าพาดเฟรม ขาย    บาท ส่งฟรีลงทะเบียน EMS+  บาท รายละเอียด --ผลิตจากวัสดุหนังเทียม+polyester   D ภายในบุฟองน้ำพิเศษอย่างหนาครับ --ด้านบนเปิดได้ทั้งตีนตุ้กแกและ ซิป ด้านข้างมีตาข่ายเก็ บของ --มีสายคล้องไหล่ ถอดสะพายได้ และ ตะขอเกี่ยวเข็มขัด --ความจุ   .  ลิตร ขนาด   x  x  .   cm --เหมาะสำหรับจักรยานทุกประเภท __ เยี่ยมชมร้าน ไบค์ สแควร์ BIKE   โอนเงินที่  กสิกร    อุกฤษฏ์ LINE ID  ukritra TEL   	ร้าน ไบค์ สแควร์ BIKE ยินดี ต้อนรับ ซื้อ ของ ร้าน นี้ มั่น ใจ ได้ ของ ถูก ชัวร์ สนใจ สั่ง ซื้อ โทร - / หรือ PM / line ukrit . ra วิธี การ สั่ง ซื้อ . กรู ณา เช็ค สินค้า ก่อน โอน เงิน ครับ . สามารถ สั่ง ซื้อ และ แจ้ง โอน เงิน ได้ ทั้ง ทาง โทรศัพท์ / PM / Line . โอน เงิน แล้ว แจ้ง ยอด / วัน ที่ / เวลา โอน ก็ พอ ครับ โอน เงิน ที่ ธ. กสิกร ไทย อุกฤษฏ์ รัตน โชติ จัด ส่ง เสร็จ แล้ว จะแจ้ง เลข พัสดุ ไปรษณีย์ ให้ ทราบ ครับ * * Roswheel กระเป๋า พาด เฟ รม ขาย บาท ส่ง ฟรี ลง ทะเบียน EMS + บาท ราย ละเอียด - - ผลิต จาก วัสดุ หนัง เทียม + polyester D ภาย ใน บุ ฟอง น้ำ พิ เศษ อย่าง หนา ครับ - - ด้าน บน เปิด ได้ ทั้ง ตีน ตุ้ก แก และ ซิป ด้าน ข้าง มี ตาข่าย เก็ บของ - - มี สาย คล้อง ไหล่ ถอด สะพาย ได้ และ ตะขอ เกี่ยว เข็มขัด - - ความ จุ . ลิตร ขนาด x x . cm - - เหมาะ สำหรับ จักรยาน ทุก ประเภท _ _ เยี่ยม ชม ร้าน ไบค์ สแควร์ BIKE โอน เงิน ที่ กสิกร อุกฤษฏ์ LINE ID ukritra TEL 	Roswheel กระเป๋าพาดเฟรม ส้มดำ สวยเท่มีสไตส์ เก็ บของได้จุใจ   บาทส่งฟรี 	post	http://www.thaimtb.com/forum/viewtopic.php?f=881&t=1141340	
